{
  "$schema": "./module.schema.json",
  "schemaVersion": 1,
  "id": "impeccable",
  "version": "4.6.0",
  "source": {
    "type": "vendored",
    "url": "https://github.com/pbakaus/impeccable",
    "tag": "skill-v4.6.0",
    "commit": "8a0e198da34ebc5b936a9d5975fb7a3b1cf353b7",
    "archiveSha256": "c537beca343b69f8da98ee1c1ad9534b9c7c3883225b060ad36a4466075d73d1"
  },
  "license": "Apache-2.0",
  "capabilities": [
    {
      "id": "general-web-design",
      "title": "General website and web-app design",
      "skill": "impeccable",
      "fallback": true,
      "triggers": []
    }
  ],
  "contributes": {
    "skills": [
      "skills/impeccable"
    ],
    "agents": [
      "agents/impeccable-asset-producer.md",
      "agents/impeccable-documenter.md",
      "agents/impeccable-finish-reviewer.md",
      "agents/impeccable-manual-edit-applier.md"
    ],
    "rules": [],
    "hooks": [],
    "scripts": [],
    "mcpServers": []
  }
}
