{
  "$schema": "./module.schema.json",
  "schemaVersion": 1,
  "id": "design-core",
  "version": "0.18.0",
  "source": {
    "type": "first-party",
    "url": "urn:geldmacher:design"
  },
  "license": "MIT",
  "capabilities": [
    {
      "id": "project-integration",
      "title": "Project setup and diagnostics",
      "skill": "design",
      "fallback": false,
      "triggers": [
        "setup",
        "checks",
        "status",
        "diagnose"
      ],
      "intents": {
        "setup": "Guide a project into design work: read-only status, confirmed init when PRODUCT.md is missing, a document scan or one seed question when DESIGN.md is missing, then a separate check offer. This command does not enable checks.",
        "checks": "Preview optional automatic checks and apply only after confirmation. This preview does not create PRODUCT.md or DESIGN.md. Optional hooks stay opt-in.",
        "status": "Explain the current Design configuration, available canonical context and optional hook state without changing anything.",
        "diagnose": "Investigate Design integration problems, conflicts or configuration drift. Report findings and proposed remedies without applying them."
      }
    },
    {
      "id": "detector-scan",
      "title": "Explicit local detector scan",
      "skill": "design",
      "fallback": false,
      "triggers": [
        "detect"
      ],
      "intents": {
        "detect": "Run the local deterministic detector on explicitly named files or directories. Do not infer targets, enable hooks or fix findings."
      }
    },
    {
      "id": "stakeholder-questionnaire",
      "title": "Stakeholder decision questionnaire",
      "skill": "design",
      "fallback": false,
      "triggers": [
        "questionnaire"
      ],
      "intents": {
        "questionnaire": "Create a stakeholder questionnaire for a product or interface decision. Preview the complete draft before approval of one exact Markdown destination; never send it or change project context."
      }
    },
    {
      "id": "change-interface-review",
      "title": "Change-scoped interface review",
      "skill": "design",
      "fallback": false,
      "triggers": [
        "review"
      ],
      "intents": {
        "review": "Assess the interface impact of Git changes, a branch, commit or pull request. A general review of a page without change scope belongs to Impeccable critique."
      }
    }
  ],
  "contributes": {
    "skills": [
      "skills/design"
    ],
    "agents": [],
    "rules": [],
    "hooks": [
      "hooks/cursor-hooks.json",
      "hooks/hooks.json"
    ],
    "scripts": [
      "skills/design/scripts/design-cli.mjs",
      "skills/design/scripts/review-scope.mjs",
      "scripts/design-cli.mjs",
      "hooks/impeccable-plugin-hook.mjs",
      "hooks/impeccable-codex-hook.mjs"
    ],
    "mcpServers": []
  }
}
